{
  "metadata": {
    "session_id": "282dafa5-1051-4e59-bb19-bba5d5666d5c",
    "mode": "DRY_RUN",
    "status": "complete",
    "current_stage": "initialized"
  },
  "brief": {
    "brand_name": "Arrowow Active",
    "product_name": "Seamless Sage Green Leggings",
    "campaign_goal": "Drive conversions by showing the squat-proof quality and comfort during a real workout.",
    "target_platform": "instagram_reels",
    "duration_seconds": 8,
    "language": "English",
    "raw_user_brief": "I need a high-energy hook showing Sienna at the gym. She needs to show off the green leggings, do a quick squat to show they are squat proof, and give a tough-love motivational quote."
  },
  "character": {
    "character_id": "sienna_fitness_01",
    "persona_name": "Sienna Bondi",
    "niche": "fitness",
    "demographics": {
      "gender": "female",
      "age": 26,
      "nationality": "Australian",
      "accent": "Australian (Sydney, casual, energetic)"
    },
    "visual_identity": {
      "latent_anchor_urls": [
        "./app/persona_vault/sienna_fitness_01/anchor_front.png"
      ],
      "appearance": "Athletic, lean build. Sun-kissed skin. Messy blonde hair, usually styled in a high ponytail, messy bun, or clipped back with a claw clip. Bright blue eyes, minimal 'clean girl' makeup.",
      "wardrobe": [
        "Matching seamless activewear sets (pastel colors like sage green, baby blue, or classic black - Gymshark/Lululemon aesthetic).",
        "Oversized vintage graphic t-shirts (pump covers) worn over biker shorts.",
        "White chunky running shoes with high white socks."
      ],
      "settings": [
        "Brightly lit modern gym with mirrors and free weights.",
        "Sunny outdoor running track or beach promenade.",
        "Minimalist aesthetic apartment living room with a yoga mat."
      ]
    },
    "voice_identity": {
      "elevenlabs_voice_id": "EXAVITQu4vr4xnSDxMaL",
      "tone": "High energy, encouraging, highly authentic. Often sounds slightly breathless, as if she just finished a set or is on a walk.",
      "pacing": "Fast and punchy, optimized for high-retention TikTok/Reels algorithms."
    },
    "behavior_rules": {
      "signature_actions": [
        "Adjusting her ponytail or clipping her hair right before speaking.",
        "Taking a sip from a massive pastel Stanley cup.",
        "Wiping a small amount of sweat from her forehead casually.",
        "Holding the camera in one hand (selfie-style) while walking."
      ],
      "prohibited_phrases": [
        "Hello everyone",
        "Welcome back to my channel",
        "Buy this product now",
        "Link in bio"
      ],
      "catchphrases": [
        "Alright team,",
        "Let's get after it today,",
        "Quick reality check:"
      ],
      "vibe": "She is your hype girl and tough-love fitness bestie. She doesn't sell products directly; she seamlessly integrates them into her actual routine."
    },
    "camera_style": {
      "angle": "Selfie-style, held slightly above eye level. Intimate and close.",
      "movement": "Slight handheld shake, dynamic pacing, frequent jump cuts to remove dead air."
    },
    "locked": true
  },
  "pre_production": {
    "strategy": {
      "hook": "Sienna adjusting her hair, looking breathless.",
      "angle": "Tough love motivation with product placement.",
      "cta": "Get after it today."
    },
    "script": {
      "script_text": "Alright team, quick reality check. If your leggings aren't squat-proof, what are we even doing? Let's get after it today.",
      "estimated_duration_seconds": 8
    },
    "text_critic_report": {
      "approved": true,
      "feedback": "Perfectly matches Sienna's tone and constraints.",
      "brand_safety_score": 1.0
    },
    "approval_gate_1": {
      "status": "pending"
    }
  },
  "visual_plan": {
    "storyboard": {
      "scenes": [
        {
          "scene": 1,
          "action": "Sienna adjusts ponytail, squats to show leggings, talks to camera.",
          "camera": "Selfie style, eye level."
        }
      ]
    },
    "wardrobe_location": {
      "wardrobe": "Sage green seamless activewear set, white chunky shoes.",
      "location": "Brightly lit modern gym."
    },
    "static_frame_prompt": {
      "static_frame_prompt": "A photorealistic portrait of an athletic 26-year-old Australian blonde woman with sun-kissed skin and bright blue eyes. She has messy blonde hair in a claw clip. She is wearing a sage green seamless activewear set. Brightly lit modern gym background. Direct front-facing view, neutral but energetic expression. UGC phone camera style, high quality."
    },
    "approval_gate_2a": {
      "status": "pending"
    }
  },
  "static_frame": {
    "prompt": "A photorealistic portrait of an athletic 26-year-old Australian blonde woman with sun-kissed skin and bright blue eyes. She has messy blonde hair in a claw clip. She is wearing a sage green seamless activewear set. Brightly lit modern gym background. Direct front-facing view, neutral but energetic expression. UGC phone camera style, high quality.",
    "provider": "mock",
    "asset_uri": "mock://image/sienna_static_frame_01.png",
    "image_critic_report": {
      "approved": true,
      "feedback": "Image geometry matches reference anchor perfectly.",
      "fidelity_score": 0.95
    },
    "approval_gate_2b": {
      "status": "pending"
    }
  },
  "production": {
    "model_route": "mock_direct_dialogue",
    "generated_video_uri": "mock://video/sienna_final_video_01.mp4",
    "generated_audio_uri": "mock://audio/sienna_voiceover_01.wav",
    "video_critic_report": {
      "approved": true,
      "feedback": "Motion is smooth, lip sync is accurate.",
      "artifact_risk": "low"
    }
  },
  "post_production": {},
  "cost_ledger": {
    "estimated_input_tokens": 0,
    "estimated_output_tokens": 0,
    "image_generations": 1,
    "video_generations": 1,
    "regenerations": 0,
    "budget_status": "within_limit",
    "tts_characters": 121
  },
  "errors": []
}