{
  "metadata": {
    "session_id": "d343886b-1c8d-4d48-b1e1-6b281c4e67d0",
    "mode": "LIVE_MEDIA",
    "status": "intake_complete",
    "current_stage": "initialized"
  },
  "brief": {
    "brand_name": "Arrowow Active",
    "product_name": "Seamless Sage Green Leggings",
    "campaign_goal": "Drive conversions by showing the squat-proof quality and comfort during a real workout.",
    "target_platform": "instagram_reels",
    "duration_seconds": 8,
    "language": "English",
    "raw_user_brief": "I need a high-energy hook showing Sienna at the gym. She needs to show off the green leggings, do a quick squat to show they are squat proof, and give a tough-love motivational quote."
  },
  "character": {
    "character_id": "sienna_fitness_01",
    "persona_name": "Sienna Bondi",
    "niche": "fitness",
    "demographics": {
      "gender": "female",
      "age": 26,
      "nationality": "Australian",
      "accent": "Australian (Sydney, casual, energetic)"
    },
    "visual_identity": {
      "latent_anchor_urls": [
        "./app/persona_vault/sienna_fitness_01/anchor_front.png"
      ],
      "appearance": "Athletic, lean build. Sun-kissed skin. Messy blonde hair, usually styled in a high ponytail, messy bun, or clipped back with a claw clip. Bright blue eyes, minimal 'clean girl' makeup.",
      "wardrobe": [
        "Matching seamless activewear sets (pastel colors like sage green, baby blue, or classic black - Gymshark/Lululemon aesthetic).",
        "Oversized vintage graphic t-shirts (pump covers) worn over biker shorts.",
        "White chunky running shoes with high white socks."
      ],
      "settings": [
        "Brightly lit modern gym with mirrors and free weights.",
        "Sunny outdoor running track or beach promenade.",
        "Minimalist aesthetic apartment living room with a yoga mat."
      ]
    },
    "voice_identity": {
      "elevenlabs_voice_id": "en-AU-Neural2-A",
      "tone": "High energy, encouraging, highly authentic. Often sounds slightly breathless, as if she just finished a set or is on a walk.",
      "pacing": "Fast and punchy, optimized for high-retention TikTok/Reels algorithms."
    },
    "behavior_rules": {
      "signature_actions": [
        "Adjusting her ponytail or clipping her hair right before speaking.",
        "Taking a sip from a massive pastel Stanley cup.",
        "Wiping a small amount of sweat from her forehead casually.",
        "Holding the camera in one hand (selfie-style) while walking."
      ],
      "prohibited_phrases": [
        "Hello everyone",
        "Welcome back to my channel",
        "Buy this product now",
        "Link in bio"
      ],
      "catchphrases": [
        "Alright team,",
        "Let's get after it today,",
        "Quick reality check:"
      ],
      "vibe": "She is your hype girl and tough-love fitness bestie. IMPORTANT FOR VIDEO: Ensure all scenes use her voice as a *voiceover* (B-roll style) while she performs actions in the video, rather than her talking directly to the camera with lip sync. This creates a highly professional, cinematic, and natural UGC feel."
    },
    "camera_style": {
      "angle": "Selfie-style, held slightly above eye level. Intimate and close.",
      "movement": "Slight handheld shake, dynamic pacing, frequent jump cuts to remove dead air."
    },
    "locked": true
  },
  "pre_production": {},
  "visual_plan": {},
  "static_frame": {},
  "production": {},
  "post_production": {},
  "cost_ledger": {
    "estimated_input_tokens": 0,
    "estimated_output_tokens": 0,
    "image_generations": 0,
    "video_generations": 0,
    "regenerations": 0,
    "budget_status": "within_limit",
    "tts_characters": 0
  },
  "errors": []
}