{
  "metadata": {
    "session_id": "06ca2815-edf2-4b4a-8576-989c6c145171",
    "mode": "LIVE_MEDIA",
    "status": "pre_production_complete",
    "current_stage": "initialized"
  },
  "brief": {
    "brand_name": "Arrowow Active",
    "product_name": "Seamless Sage Green Leggings",
    "campaign_goal": "Drive conversions by showing the squat-proof quality and comfort during a real workout.",
    "target_platform": "instagram_reels",
    "duration_seconds": 8,
    "language": "English",
    "raw_user_brief": "I need a high-energy hook showing Sienna at the gym. She needs to show off the green leggings, do a quick squat to show they are squat proof, and give a tough-love motivational quote."
  },
  "character": {
    "character_id": "sienna_fitness_01",
    "persona_name": "Sienna Bondi",
    "niche": "fitness",
    "demographics": {
      "gender": "female",
      "age": 26,
      "nationality": "Australian",
      "accent": "Australian (Sydney, casual, energetic)"
    },
    "visual_identity": {
      "latent_anchor_urls": [
        "./app/persona_vault/sienna_fitness_01/anchor_front.png"
      ],
      "appearance": "Athletic, lean build. Sun-kissed skin. Messy blonde hair, usually styled in a high ponytail, messy bun, or clipped back with a claw clip. Bright blue eyes, minimal 'clean girl' makeup.",
      "wardrobe": [
        "Matching seamless activewear sets (pastel colors like sage green, baby blue, or classic black - Gymshark/Lululemon aesthetic).",
        "Oversized vintage graphic t-shirts (pump covers) worn over biker shorts.",
        "White chunky running shoes with high white socks."
      ],
      "settings": [
        "Brightly lit modern gym with mirrors and free weights.",
        "Sunny outdoor running track or beach promenade.",
        "Minimalist aesthetic apartment living room with a yoga mat."
      ]
    },
    "voice_identity": {
      "elevenlabs_voice_id": "EXAVITQu4vr4xnSDxMaL",
      "tone": "High energy, encouraging, highly authentic. Often sounds slightly breathless, as if she just finished a set or is on a walk.",
      "pacing": "Fast and punchy, optimized for high-retention TikTok/Reels algorithms."
    },
    "behavior_rules": {
      "signature_actions": [
        "Adjusting her ponytail or clipping her hair right before speaking.",
        "Taking a sip from a massive pastel Stanley cup.",
        "Wiping a small amount of sweat from her forehead casually.",
        "Holding the camera in one hand (selfie-style) while walking."
      ],
      "prohibited_phrases": [
        "Hello everyone",
        "Welcome back to my channel",
        "Buy this product now",
        "Link in bio"
      ],
      "catchphrases": [
        "Alright team,",
        "Let's get after it today,",
        "Quick reality check:"
      ],
      "vibe": "She is your hype girl and tough-love fitness bestie. She doesn't sell products directly; she seamlessly integrates them into her actual routine."
    },
    "camera_style": {
      "angle": "Selfie-style, held slightly above eye level. Intimate and close.",
      "movement": "Slight handheld shake, dynamic pacing, frequent jump cuts to remove dead air."
    },
    "locked": true
  },
  "pre_production": {
    "strategy": {
      "angle": "Experience the ultimate workout confidence with Arrowow Active Seamless Sage Green Leggings. Designed for peak performance, they offer unmatched comfort and a squat-proof guarantee, so you can focus on your gains, not your gear.",
      "cta": "Ready to unleash your inner beast? Shop the Seamless Sage Green Leggings now! Link in bio.",
      "hook": "Sienna's crushing it at the gym! \ud83d\udd25 Squat-proof? Absolutely. 'Your only limit is you.'"
    },
    "script": {
      "script": "[SCENE START]\n\n[0:00-0:02] VIDEO: Sienna, mid-gym session, slightly breathless. She adjusts her messy ponytail, sweat glistening lightly on her forehead. Holding the camera selfie-style.\nSIENNA: Alright team, just absolutely smashed leg day! (Wipes forehead casually)\n\n[0:02-0:05] VIDEO: Quick cut. Sienna doing a deep squat, showcasing her leggings. Stands up, hands on hips, a playful, confident smirk.\nSIENNA: Quick reality check: You ever worry about... is it gonna hold up?! (Gestures to her leggings, then flexes a bicep jokingly)\n\n[0:05-0:09] VIDEO: Close-up on the Arrowow Active Seamless Sage Green Leggings as Sienna stretches or walks. Handheld shake. Cut to Sienna leaning into the camera, energetic.\nSIENNA: Well, let me tell ya, these Arrowow Active seamless leggings? Absolute game-changer. Seriously, ultimate workout confidence.\n\n[0:09-0:13] VIDEO: Sienna performing a powerful lift or dynamic pose, looking focused and strong. Overlay text: \"Squat-Proof Guarantee.\"\nSIENNA: Super comfy, super supportive, and yeah, 100% squat-proof. Means you can just focus on those gains, not your gear. Your only limit is you, babes!\n\n[0:13-0:16] VIDEO: Sienna takes a powerful sip from her massive pastel Stanley cup, then turns back to the camera, vibrant and encouraging. Slight handheld shake.\nSIENNA: So, ready to unleash your inner beast with gear that backs you up?\n\n[0:16-0:18] VIDEO: Sienna points off-screen, a confident, knowing smile. A text overlay appears with \"Shop Arrowow Active. Link in Bio.\"\nSIENNA: Go check out the Seamless Sage Green Leggings! Link is right there, you know where to find it. Let's get after it today!\n\n[SCENE END]"
    },
    "text_critic_report": {
      "overall_assessment": "The script largely aligns with Sienna's persona, maintaining a high-energy, encouraging, and authentic tone. It effectively integrates persona catchphrases and embodies the 'hype girl' vibe. However, there are two instances where the script subtly violates the persona's prohibited phrases and selling approach.",
      "issues_found": [
        {
          "type": "prohibited_phrase_violation",
          "description": "The phrase \"Link is right there, you know where to find it.\" at the end of the script is functionally equivalent to the prohibited phrase \"Link in bio,\" violating the persona rule against direct calls to action for links.",
          "location": "[0:16-0:18]",
          "rule_violated": "prohibited_phrases: ['Link in bio']"
        },
        {
          "type": "vibe_inconsistency",
          "description": "The direct call to action, \"Go check out the Seamless Sage Green Leggings!\" is quite explicit and borders on directly selling the product. This conflicts with the persona's vibe that \"She doesn't sell products directly; she seamlessly integrates them into her actual routine.\"",
          "location": "[0:16-0:18]",
          "rule_violated": "vibe: \"She doesn't sell products directly; she seamlessly integrates them into her actual routine.\""
        }
      ],
      "recommendations": [
        "Rephrase the concluding sentence to integrate the product more subtly without directly prompting users to 'check out' or indicating a 'link'. Perhaps Sienna could simply state her continued satisfaction with the leggings, maintaining authenticity without direct selling or link references.",
        "Consider replacing the mention of 'link' with a more organic lead-in if further product information is desired, or omit it entirely to strictly adhere to the 'no direct selling' rule."
      ]
    },
    "approval_gate_1": {
      "status": "pending"
    }
  },
  "visual_plan": {},
  "static_frame": {},
  "production": {},
  "post_production": {},
  "cost_ledger": {
    "estimated_input_tokens": 0,
    "estimated_output_tokens": 0,
    "image_generations": 0,
    "video_generations": 0,
    "regenerations": 0,
    "budget_status": "within_limit",
    "tts_characters": 0
  },
  "errors": []
}