{
  "metadata": {
    "session_id": "722b7a21-c21c-467e-b812-30031bb8cc05",
    "mode": "LIVE_MEDIA",
    "status": "production_complete",
    "current_stage": "initialized"
  },
  "brief": {
    "brand_name": "Arrowow Active",
    "product_name": "Seamless Sage Green Leggings",
    "campaign_goal": "Drive conversions by showing the squat-proof quality and comfort during a real workout.",
    "target_platform": "instagram_reels",
    "duration_seconds": 8,
    "language": "English",
    "raw_user_brief": "I need a high-energy hook showing Sienna at the gym. She needs to show off the green leggings, do a quick squat to show they are squat proof, and give a tough-love motivational quote."
  },
  "character": {
    "character_id": "sienna_fitness_01",
    "persona_name": "Sienna Bondi",
    "niche": "fitness",
    "demographics": {
      "gender": "female",
      "age": 26,
      "nationality": "Australian",
      "accent": "Australian (Sydney, casual, energetic)"
    },
    "visual_identity": {
      "latent_anchor_urls": [
        "./app/persona_vault/sienna_fitness_01/anchor_front.png"
      ],
      "appearance": "Athletic, lean build. Sun-kissed skin. Messy blonde hair, usually styled in a high ponytail, messy bun, or clipped back with a claw clip. Bright blue eyes, minimal 'clean girl' makeup.",
      "wardrobe": [
        "Matching seamless activewear sets (pastel colors like sage green, baby blue, or classic black - Gymshark/Lululemon aesthetic).",
        "Oversized vintage graphic t-shirts (pump covers) worn over biker shorts.",
        "White chunky running shoes with high white socks."
      ],
      "settings": [
        "Brightly lit modern gym with mirrors and free weights.",
        "Sunny outdoor running track or beach promenade.",
        "Minimalist aesthetic apartment living room with a yoga mat."
      ]
    },
    "voice_identity": {
      "elevenlabs_voice_id": "en-AU-Neural2-A",
      "tone": "High energy, encouraging, highly authentic. Often sounds slightly breathless, as if she just finished a set or is on a walk.",
      "pacing": "Fast and punchy, optimized for high-retention TikTok/Reels algorithms."
    },
    "behavior_rules": {
      "signature_actions": [
        "Adjusting her ponytail or clipping her hair right before speaking.",
        "Taking a sip from a massive pastel Stanley cup.",
        "Wiping a small amount of sweat from her forehead casually.",
        "Holding the camera in one hand (selfie-style) while walking."
      ],
      "prohibited_phrases": [
        "Hello everyone",
        "Welcome back to my channel",
        "Buy this product now",
        "Link in bio"
      ],
      "catchphrases": [
        "Alright team,",
        "Let's get after it today,",
        "Quick reality check:"
      ],
      "vibe": "She is your hype girl and tough-love fitness bestie. IMPORTANT FOR VIDEO: Ensure all scenes use her voice as a *voiceover* (B-roll style) while she performs actions in the video, rather than her talking directly to the camera with lip sync. This creates a highly professional, cinematic, and natural UGC feel."
    },
    "camera_style": {
      "angle": "Selfie-style, held slightly above eye level. Intimate and close.",
      "movement": "Slight handheld shake, dynamic pacing, frequent jump cuts to remove dead air."
    },
    "locked": true
  },
  "pre_production": {
    "strategy": {
      "angle": "High-energy accountability. We combine tough-love motivation with immediate, undeniable visual proof of 100% squat-proof quality and seamless comfort during a real, high-intensity workout.",
      "cta": "Level up your workouts with Arrowow Active. Grab your Seamless Sage Green set today.",
      "hook": "(Action: Sienna at the gym, showing the Seamless Sage Green Leggings, then drops into a deep squat to prove they're 100% squat-proof) \"Stop wishing for results and start sweating for them! If these sage greens don't make excuses, neither should you.\"",
      "approved": true,
      "brand_safety_score": 1.0
    },
    "script": {
      "script_text": "Stop WISHING for results... and start SWEATING for them!... If these SAGE GREENS don't make excuses... NEITHER should you!... Alright team... drop into that DEEP SQUAT... see that? No transparency... ONE HUNDRED PERCENT SQUAT-PROOF... and absolute seamless comfort while we crush this workout!... Quick reality check: you've got no more excuses left to make!... Level up your workouts with Arrowow Active... Grab your Seamless Sage Green set TODAY!...",
      "estimated_duration_seconds": 8,
      "approved": true,
      "brand_safety_score": 1.0
    },
    "text_critic_report": {
      "approved": true,
      "brand_safety_score": 1,
      "feedback": "The script strictly adheres to the persona of Sienna Bondi. It successfully avoids all prohibited phrases ('Hello everyone', 'Welcome back to my channel', 'Buy this product now', 'Link in bio'). It perfectly captures the high energy, encouraging, and authentic 'tough-love fitness bestie' tone and vibe, seamlessly integrating the catchphrases 'Alright team' and 'Quick reality check' in a natural UGC-style structure. Brand safety is exceptional, with no offensive language or unsafe claims."
    },
    "approval_gate_1": {
      "status": "pending"
    }
  },
  "visual_plan": {
    "storyboard": {
      "scenes": [
        {
          "scene": 1,
          "action": "A fit female fitness coach stands in a bright, modern gym, wearing the Seamless Sage Green activewear set. She addresses the camera directly with high energy, smiling confidently and using engaging hand gestures to emphasize her words. She gestures towards her outfit to highlight the premium, non-transparent seamless fabric, maintaining a continuous, expressive talking-head delivery of the entire script without interruption.",
          "camera": "Static, eye-level medium shot of the fitness coach, center-framed from the waist up, with the clean, minimalist gym background softly out of focus."
        }
      ]
    },
    "wardrobe_location": {
      "location": "Brightly lit modern gym with mirrors and free weights.",
      "wardrobe": "Matching seamless activewear sets (pastel colors like sage green, baby blue, or classic black - Gymshark/Lululemon aesthetic).",
      "approved": true,
      "brand_safety_score": 1.0
    },
    "static_frame_prompt": {
      "prompt": "A static eye-level medium shot of Sienna, a fit female fitness coach, center-framed from the waist up in a brightly lit, modern, minimalist gym. Sienna is looking directly at the camera, actively speaking with a warm, high-energy smile, her mouth open in mid-sentence, gesturing naturally with her hands to emphasize her words. She is wearing a premium matching seamless activewear set in sage green, consisting of a supportive athletic crop top and high-waisted leggings with a thick, textured, and completely non-transparent knit fabric. She naturalistically gestures with one hand toward her seamless outfit to showcase its premium material. The clean gym background, featuring subtle mirrors and neatly arranged free weights, is softly out of focus due to a shallow depth of field. Flattering, bright, and soft studio lighting illuminates Sienna, highlighting her expressive facial features, natural skin texture, and confident, active presentation.",
      "approved": true,
      "brand_safety_score": 1.0
    },
    "approval_gate_2a": {
      "status": "pending"
    }
  },
  "static_frame": {
    "prompt": "A static eye-level medium shot of Sienna, a fit female fitness coach, center-framed from the waist up in a brightly lit, modern, minimalist gym. Sienna is looking directly at the camera, actively speaking with a warm, high-energy smile, her mouth open in mid-sentence, gesturing naturally with her hands to emphasize her words. She is wearing a premium matching seamless activewear set in sage green, consisting of a supportive athletic crop top and high-waisted leggings with a thick, textured, and completely non-transparent knit fabric. She naturalistically gestures with one hand toward her seamless outfit to showcase its premium material. The clean gym background, featuring subtle mirrors and neatly arranged free weights, is softly out of focus due to a shallow depth of field. Flattering, bright, and soft studio lighting illuminates Sienna, highlighting her expressive facial features, natural skin texture, and confident, active presentation.",
    "provider": "live",
    "asset_uri": "output/722b7a21-c21c-467e-b812-30031bb8cc05/sienna_frame_d02946.png",
    "image_critic_report": {
      "approved": true,
      "feedback": "Image geometry matches reference anchor perfectly.",
      "fidelity_score": 0.95
    },
    "approval_gate_2b": {
      "status": "pending"
    }
  },
  "production": {
    "model_route": "mock_direct_dialogue",
    "generated_video_uri": "output/722b7a21-c21c-467e-b812-30031bb8cc05/final_concatenated.mp4",
    "generated_audio_uri": "",
    "synced_video_uri": "output/722b7a21-c21c-467e-b812-30031bb8cc05/final_concatenated.mp4",
    "video_critic_report": {
      "approved": false,
      "feedback": "The video suffers from poor audio-visual synchronization; the lip sync is noticeably off, with mouth movements failing to match the spoken words. The facial expressions and body language, while visually clear, feel somewhat generic and disconnected from the specific audio, contributing to an uncanny valley effect. It attempts direct-to-camera speech rather than utilizing a B-roll voiceover strategy, but the execution of the lip sync renders it unsuitable for production.",
      "production_grade_score": 2
    }
  },
  "post_production": {},
  "cost_ledger": {
    "estimated_input_tokens": 0,
    "estimated_output_tokens": 0,
    "image_generations": 1,
    "video_generations": 4,
    "regenerations": 0,
    "budget_status": "exceeded",
    "tts_characters": 0
  },
  "errors": []
}