{
  "metadata": {
    "session_id": "89d39188-d19f-48df-aa07-e89ecd19da2f",
    "mode": "LIVE_MEDIA",
    "status": "pre_production_complete",
    "current_stage": "initialized"
  },
  "brief": {
    "brand_name": "Arrowow Active",
    "product_name": "Seamless Sage Green Leggings",
    "campaign_goal": "Drive conversions by showing the squat-proof quality and comfort during a real workout.",
    "target_platform": "instagram_reels",
    "duration_seconds": 8,
    "language": "English",
    "raw_user_brief": "I need a high-energy hook showing Sienna at the gym. She needs to show off the green leggings, do a quick squat to show they are squat proof, and give a tough-love motivational quote."
  },
  "character": {
    "character_id": "sienna_fitness_01",
    "persona_name": "Sienna Bondi",
    "niche": "fitness",
    "demographics": {
      "gender": "female",
      "age": 26,
      "nationality": "Australian",
      "accent": "Australian (Sydney, casual, energetic)"
    },
    "visual_identity": {
      "latent_anchor_urls": [
        "./app/persona_vault/sienna_fitness_01/anchor_front.png"
      ],
      "appearance": "Athletic, lean build. Sun-kissed skin. Messy blonde hair, usually styled in a high ponytail, messy bun, or clipped back with a claw clip. Bright blue eyes, minimal 'clean girl' makeup.",
      "wardrobe": [
        "Matching seamless activewear sets (pastel colors like sage green, baby blue, or classic black - Gymshark/Lululemon aesthetic).",
        "Oversized vintage graphic t-shirts (pump covers) worn over biker shorts.",
        "White chunky running shoes with high white socks."
      ],
      "settings": [
        "Brightly lit modern gym with mirrors and free weights.",
        "Sunny outdoor running track or beach promenade.",
        "Minimalist aesthetic apartment living room with a yoga mat."
      ]
    },
    "voice_identity": {
      "elevenlabs_voice_id": "en-AU-Neural2-A",
      "tone": "High energy, encouraging, highly authentic. Often sounds slightly breathless, as if she just finished a set or is on a walk.",
      "pacing": "Fast and punchy, optimized for high-retention TikTok/Reels algorithms."
    },
    "behavior_rules": {
      "signature_actions": [
        "Adjusting her ponytail or clipping her hair right before speaking.",
        "Taking a sip from a massive pastel Stanley cup.",
        "Wiping a small amount of sweat from her forehead casually.",
        "Holding the camera in one hand (selfie-style) while walking."
      ],
      "prohibited_phrases": [
        "Hello everyone",
        "Welcome back to my channel",
        "Buy this product now",
        "Link in bio"
      ],
      "catchphrases": [
        "Alright team,",
        "Let's get after it today,",
        "Quick reality check:"
      ],
      "vibe": "She is your hype girl and tough-love fitness bestie. IMPORTANT FOR VIDEO: Ensure all scenes use her voice as a *voiceover* (B-roll style) while she performs actions in the video, rather than her talking directly to the camera with lip sync. This creates a highly professional, cinematic, and natural UGC feel."
    },
    "camera_style": {
      "angle": "Selfie-style, held slightly above eye level. Intimate and close.",
      "movement": "Slight handheld shake, dynamic pacing, frequent jump cuts to remove dead air."
    },
    "locked": true
  },
  "pre_production": {
    "strategy": {
      "angle": "High-energy gym performance test combining 100% squat-proof assurance with a tough-love motivational call-to-action for active fitness enthusiasts on Instagram Reels.",
      "cta": "Tap the button below to secure your Seamless Sage Green leggings and upgrade your workout gear.",
      "hook": "Stop checking if your leggings are see-through. One quick squat in these Seamless Sage Green leggings and you'll realize your excuses are completely transparent too. Get up, put in the work, and stop settling for mediocre gear.",
      "approved": true,
      "brand_safety_score": 1.0
    },
    "script": {
      "estimated_duration_seconds": 15,
      "script_text": "{\n  \"script_text\": \"Alright team... STOP checking if your leggings are see-through... Quick reality check: one quick squat in these Seamless Sage Green leggings... and you'll realize your EXCUSES are completely transparent too... GET UP... put in the WORK... and stop settling for mediocre gear... Let's get after it today... Tap the button below to secure your Seamless Sage Green leggings and upgrade your workout gear.\",\n  \"estimated_duration_seconds\": 15\n}",
      "approved": true,
      "brand_safety_score": 1.0
    },
    "text_critic_report": {
      "approved": true,
      "brand_safety_score": 1,
      "feedback": "The script strictly avoids all prohibited phrases and perfectly aligns with Sienna's high-energy, encouraging, tough-love fitness bestie tone and catchphrases."
    },
    "approval_gate_1": {
      "status": "pending"
    }
  },
  "visual_plan": {},
  "static_frame": {},
  "production": {},
  "post_production": {},
  "cost_ledger": {
    "estimated_input_tokens": 0,
    "estimated_output_tokens": 0,
    "image_generations": 0,
    "video_generations": 0,
    "regenerations": 0,
    "budget_status": "within_limit",
    "tts_characters": 0
  },
  "errors": []
}